"DESCRIPTION","DURATION IN MS","NAME","PARENT SUITE","START TIME","STATUS","STOP TIME","SUB SUITE","SUITE","TEST CLASS","TEST METHOD"
"Verify that null values in DTO patch do not overwrite existing entity values","2","updateEntity_withNullEnabled_doesNotOverwrite()","","Tue Dec 02 16:52:32 UTC 2025","passed","Tue Dec 02 16:52:32 UTC 2025","","com.dmdwyer.devstream.mapper.FlagMapperTest","com.dmdwyer.devstream.mapper.FlagMapperTest","updateEntity_withNullEnabled_doesNotOverwrite"
"Verify that Spring Boot application context loads successfully","7","contextLoads()","","Tue Dec 02 16:52:32 UTC 2025","passed","Tue Dec 02 16:52:32 UTC 2025","","com.dmdwyer.devstream.DevstreamPortfolioApplicationTests","com.dmdwyer.devstream.DevstreamPortfolioApplicationTests","contextLoads"
"Integration test that creates a new feature flag via POST and verifies it can be retrieved via GET","824","createAndGetFlags()","","Tue Dec 02 16:52:31 UTC 2025","passed","Tue Dec 02 16:52:32 UTC 2025","","com.dmdwyer.devstream.FlagControllerIntegrationTest","com.dmdwyer.devstream.FlagControllerIntegrationTest","createAndGetFlags"
"Verify that enabled field defaults to false when not specified in DTO","1","toEntity_defaultEnabledIsFalse_whenDtoNull()","","Tue Dec 02 16:52:32 UTC 2025","passed","Tue Dec 02 16:52:32 UTC 2025","","com.dmdwyer.devstream.mapper.FlagMapperTest","com.dmdwyer.devstream.mapper.FlagMapperTest","toEntity_defaultEnabledIsFalse_whenDtoNull"
"Verify that explicit false values in DTO patch do overwrite existing entity values","1","updateEntity_withEnabledFalse_overwrites()","","Tue Dec 02 16:52:32 UTC 2025","passed","Tue Dec 02 16:52:32 UTC 2025","","com.dmdwyer.devstream.mapper.FlagMapperTest","com.dmdwyer.devstream.mapper.FlagMapperTest","updateEntity_withEnabledFalse_overwrites"
"Verify that MapStruct annotation processor has generated the FlagMapperImpl class","6","generatedImplementationShouldBePresent()","","Tue Dec 02 16:52:32 UTC 2025","passed","Tue Dec 02 16:52:32 UTC 2025","","com.dmdwyer.devstream.mapper.FlagMapperTest","com.dmdwyer.devstream.mapper.FlagMapperTest","generatedImplementationShouldBePresent"
